{
  "paper_id": "2021_A_A21102860073",
  "year": 2021,
  "track": "A",
  "title": "相关矩阵组的低复杂度计算和存储建模",
  "confidence": "high",
  "per_question_method_chain": [
    {
      "question_id": "问题一(计算优化)",
      "baseline": "常规逐矩阵独立SVD(Golub-Kahan双对角化+QR)与直接矩阵求逆",
      "main_model": "先做矩阵相关性/稀疏性分析，设立相邻矩阵相关系数阈值λth做强关联矩阵间中间矩阵V替代；再分别用随机正交基SVD与逐次超松弛SOR迭代求逆",
      "improvement": "SVD与求逆两条线并行降复杂度",
      "why_switch": "逐矩阵独立计算不利用矩阵间关联，复杂度O(N^3)级；先做数据驱动的关联性分析才能决定哪些矩阵可替代、哪些算子可替换"
    },
    {
      "question_id": "问题二(压缩存储)",
      "baseline": "通用稀疏基压缩重建",
      "main_model": "两条压缩路线：基于SVD的压缩模型(存至20%)与基于空间正交基的压缩感知模型",
      "improvement": "按压缩率/算力需求分场景选型",
      "why_switch": "SVD压缩率高但运算资源充裕才行；空间正交基压缩感知运算复杂度低一个数量级，适合算力受限场景，需按场景取舍"
    },
    {
      "question_id": "问题三(端到端整合)",
      "baseline": "问题一、二独立使用",
      "main_model": "三方向整合：空间正交基辅助λth判断、压缩与SVD过程合并、用中间矩阵Vk相关性提高Wk压缩效率",
      "improvement": "端到端MATLAB整体模型",
      "why_switch": "分立模型有冗余计算，整合后进一步降复杂度"
    }
  ],
  "key_formulas_and_assumptions": [
    "目标ρmin(W)>0.99(最小相关系数)，实测达99.99%精度",
    "压缩误差目标err_max=-30dB",
    "假设实数加法/读写/比较的复杂度按题目给定单位表计算",
    "建立标准运算复杂度表，以单位计算次数统一计量"
  ],
  "objective_function": "在满足精度ρmin(W)与压缩误差err_max约束下，最小化端到端总运算复杂度与存储复杂度",
  "evaluation_metrics": [
    "SVD复杂度降46.0%",
    "求逆复杂度降85.9%",
    "随机正交基SVD较Golub-Kahan降38.7%",
    "SOR降至传统24.7%",
    "总复杂度降72.8%且保持99.99%最小精度"
  ],
  "algorithm_details_and_complexity": "先数据驱动分析相关性(同行强、矩阵内弱)与稀疏性(可建稀疏基)，再λth阈值替代、随机正交基SVD提前截断奇异值序列、SOR迭代求逆，四类优化合并",
  "independent_validation_design": "MATLAB多次随机测试，以99.99%最小精度达标为独立验收；两压缩模型分别在压缩率优先与算力优先场景交叉验证",
  "sensitivity_robustness_ablation": [
    "λth相邻矩阵相关系数阈值的灵敏度",
    "两种压缩路线在压缩率-运算复杂度象限的对比",
    "总复杂度72.8%下降的鲁棒性"
  ],
  "abstract_deconstruction": {
    "first_sentence": "以大规模阵列传感器/雷达/天线为背景，点出阵列扩大后常规算法计算存储需求倍增的矛盾",
    "method_sentence": "先做相关性与稀疏性两维分析得关键结论，再对计算与压缩分别建模，最后三方向整合",
    "result_sentence": "四优化合并在保持99.99%精度下总运算复杂度降72.8%",
    "numbers_presentation": "用一组并列百分比(46.0%/85.9%/38.7%/24.7%/72.8%)逐层累积降复杂度，数字即卖点"
  },
  "figure_narrative_order": [
    "相关性/稀疏性分析图",
    "标准运算复杂度表",
    "λth阈值替代示意图",
    "SOR迭代收敛曲线",
    "两压缩模型对比"
  ],
  "judge_high_score_reasons": [
    "先做数据驱动的相关性/稀疏性机理分析再选算子，不是套算法而是有理论洞察",
    "建立标准运算复杂度表，把所有步骤折算成单位计算次数，比较严谨可复算",
    "四个降复杂度技术层层叠加且各自给量化降幅，72.8%总降幅有说服力",
    "压缩模型给出两条路线并明确各自适用场景，体现权衡而非一刀切"
  ],
  "reusable_patterns": [
    "先分析数据内在结构(相关性/稀疏性)再决定算法替换",
    "用阈值λth做相似样本替代",
    "把所有操作折算成统一复杂度单位再优化",
    "同问题给多条技术路线并按场景选型"
  ],
  "transferable_ability_card_candidates": [
    "大规模矩阵低复杂度算法设计",
    "复杂度定量核算与对比",
    "压缩感知/稀疏基建模"
  ],
  "page_locations": {
    "摘要与贡献": "p1-3",
    "问题一模型建立(正文)": "p8",
    "问题二模型建立(正文)": "p31",
    "问题三模型建立(正文)": "p38",
    "SOR逐次超松弛": "p18-19,26-27",
    "压缩感知": "p31,40-41"
  },
  "notes": "数模之星提名奖",
  "award_level": "一等奖",
  "award_confidence": "high"
}